{
  "artifact_id": "sha256:9f2c000000000000000000000000000000000000000000000000000000000001",
  "files": [
    {
      "bytes": 12,
      "path": "evidence.json",
      "sha256": "sha256:c0de000000000000000000000000000000000000000000000000000000000004"
    }
  ],
  "inputs": [],
  "kind": "evidence.probe.v1",
  "policy": "local-lock",
  "producer": {
    "implementation": "ffprobe-adapter@1.0.0",
    "stage": "probe"
  },
  "recipe": {
    "config": {
      "include_streams": true,
      "schema": "probe.v1"
    },
    "key_version": "clipmill.artifact.key.v1",
    "semantic_version": "1.0.0"
  },
  "schema_version": "clipmill.artifact.manifest.v1",
  "source_fingerprint": "sha256:31ab000000000000000000000000000000000000000000000000000000000006",
  "timebase": {
    "den": 90000,
    "num": 1
  }
}
